{
  "kind": "quality-shadow-report-v1",
  "version": 1,
  "workload": {
    "name": "desktop-pr286",
    "base": "ee8472486377c30ecced3ef1ec07012fd8a06f24",
    "head": "ca3970a4c536addfc48409db1c22ebb4e0ce9ae6"
  },
  "sampleCount": 5,
  "decision": "retain-split",
  "criteria": {
    "wallNonRegressing": false,
    "runnerImproves": true,
    "childParity": true
  },
  "split": {
    "kind": "timing-report-v1",
    "version": 1,
    "profile": "quality-split",
    "sampleCount": 5,
    "samples": [
      {
        "commit": "55f2825196008030ef390178e98cf6c6393168d6",
        "runId": "34008548967",
        "lanes": ["build", "static", "typecheck", "unit"],
        "setupMs": 103132,
        "executionMs": 462287,
        "longestLaneMs": 170924,
        "wallClockMs": 209663,
        "runnerMinutes": 10.01975
      },
      {
        "commit": "55f2825196008030ef390178e98cf6c6393168d6",
        "runId": "34008551247",
        "lanes": ["build", "static", "typecheck", "unit"],
        "setupMs": 105188,
        "executionMs": 523156,
        "longestLaneMs": 218973,
        "wallClockMs": 256063,
        "runnerMinutes": 11.108216666666667
      },
      {
        "commit": "55f2825196008030ef390178e98cf6c6393168d6",
        "runId": "34008553090",
        "lanes": ["build", "static", "typecheck", "unit"],
        "setupMs": 104257,
        "executionMs": 530488,
        "longestLaneMs": 230126,
        "wallClockMs": 268700,
        "runnerMinutes": 11.2238
      },
      {
        "commit": "55f2825196008030ef390178e98cf6c6393168d6",
        "runId": "34008555415",
        "lanes": ["build", "static", "typecheck", "unit"],
        "setupMs": 104689,
        "executionMs": 527588,
        "longestLaneMs": 215417,
        "wallClockMs": 247706,
        "runnerMinutes": 11.140733333333333
      },
      {
        "commit": "55f2825196008030ef390178e98cf6c6393168d6",
        "runId": "34008557924",
        "lanes": ["build", "static", "typecheck", "unit"],
        "setupMs": 99479,
        "executionMs": 445932,
        "longestLaneMs": 165920,
        "wallClockMs": 203686,
        "runnerMinutes": 9.744516666666666
      }
    ],
    "metrics": {
      "setupMs": {
        "p50": 104257,
        "p95": 105088.2,
        "samples": 5
      },
      "executionMs": {
        "p50": 523156,
        "p95": 529908,
        "samples": 5
      },
      "longestLaneMs": {
        "p50": 215417,
        "p95": 227895.4,
        "samples": 5
      },
      "wallClockMs": {
        "p50": 247706,
        "p95": 266172.6,
        "samples": 5
      },
      "runnerMinutes": {
        "p50": 11.108216666666667,
        "p95": 11.207186666666667,
        "samples": 5
      }
    },
    "provenance": {
      "generator": "ci-cd-platform-v2/compare-timings@1",
      "sourceRuns": ["34008548967", "34008551247", "34008553090", "34008555415", "34008557924"]
    },
    "digest": "cb3b7c7bfef5753c6ab4987eae03294d308d02c60b0da96bd3de043b2fae1bb6"
  },
  "consolidated": {
    "kind": "timing-report-v1",
    "version": 1,
    "profile": "quality-consolidated",
    "sampleCount": 5,
    "samples": [
      {
        "commit": "55f2825196008030ef390178e98cf6c6393168d6",
        "runId": "34008548967",
        "lanes": ["build", "static", "typecheck", "unit"],
        "setupMs": 30902,
        "executionMs": 317374,
        "longestLaneMs": 163991,
        "wallClockMs": 357980,
        "runnerMinutes": 5.966333333333333
      },
      {
        "commit": "55f2825196008030ef390178e98cf6c6393168d6",
        "runId": "34008551247",
        "lanes": ["build", "static", "typecheck", "unit"],
        "setupMs": 29087,
        "executionMs": 421667,
        "longestLaneMs": 223906,
        "wallClockMs": 460157,
        "runnerMinutes": 7.6692833333333335
      },
      {
        "commit": "55f2825196008030ef390178e98cf6c6393168d6",
        "runId": "34008553090",
        "lanes": ["build", "static", "typecheck", "unit"],
        "setupMs": 28021,
        "executionMs": 421338,
        "longestLaneMs": 223463,
        "wallClockMs": 458639,
        "runnerMinutes": 7.643983333333333
      },
      {
        "commit": "55f2825196008030ef390178e98cf6c6393168d6",
        "runId": "34008555415",
        "lanes": ["build", "static", "typecheck", "unit"],
        "setupMs": 33287,
        "executionMs": 332111,
        "longestLaneMs": 174123,
        "wallClockMs": 374852,
        "runnerMinutes": 6.247533333333333
      },
      {
        "commit": "55f2825196008030ef390178e98cf6c6393168d6",
        "runId": "34008557924",
        "lanes": ["build", "static", "typecheck", "unit"],
        "setupMs": 27620,
        "executionMs": 439865,
        "longestLaneMs": 235449,
        "wallClockMs": 476676,
        "runnerMinutes": 7.9446
      }
    ],
    "metrics": {
      "setupMs": {
        "p50": 29087,
        "p95": 32810,
        "samples": 5
      },
      "executionMs": {
        "p50": 421338,
        "p95": 436225.4,
        "samples": 5
      },
      "longestLaneMs": {
        "p50": 223463,
        "p95": 233140.4,
        "samples": 5
      },
      "wallClockMs": {
        "p50": 458639,
        "p95": 473372.2,
        "samples": 5
      },
      "runnerMinutes": {
        "p50": 7.643983333333333,
        "p95": 7.889536666666667,
        "samples": 5
      }
    },
    "provenance": {
      "generator": "ci-cd-platform-v2/compare-timings@1",
      "sourceRuns": ["34008548967", "34008551247", "34008553090", "34008555415", "34008557924"]
    },
    "digest": "d2fcd7796c6d1640a88622847b722930c77681807fbd47a01941c82d205b6c03"
  },
  "delta": {
    "setupMs": {
      "p50": -75170,
      "p95": -72278.2
    },
    "executionMs": {
      "p50": -101818,
      "p95": -93682.59999999998
    },
    "longestLaneMs": {
      "p50": 8046,
      "p95": 5245
    },
    "wallClockMs": {
      "p50": 210933,
      "p95": 207199.60000000003
    },
    "runnerMinutes": {
      "p50": -3.4642333333333344,
      "p95": -3.3176499999999995
    }
  },
  "provenance": {
    "generator": "ci-cd-platform-v3/compare-quality-shadow@1",
    "sourceRuns": ["34008548967", "34008551247", "34008553090", "34008555415", "34008557924"],
    "controlPlaneShas": ["55f2825196008030ef390178e98cf6c6393168d6"]
  },
  "digest": "7286921ed867531e478dbc0f93bac5718bd5e5f9c2ff4c40634fcde1515f84e9"
}
